{
  "schema_version": "0.1.1",
  "assurance_id": "example-soc2-period-2026",
  "vendor_id": "example-vendor",
  "assurance_class": "attestation_report",
  "framework": {
    "framework_id": "soc2",
    "framework_version": null,
    "display_name": "SOC 2"
  },
  "subject": {
    "entity_name": "Example Vendor Inc.",
    "scope_description": "Example trust services system"
  },
  "issuer": {
    "name": "Example Audit LLP",
    "authority_type": "audit_firm",
    "accreditation_body": null,
    "country": "US"
  },
  "temporal_scope": {
    "issued_at": "2026-06-15",
    "reporting_period": {
      "start": "2025-06-01",
      "end": "2026-05-31"
    }
  },
  "evidence": {
    "source_ids": [
      "example-soc2-source"
    ]
  },
  "advisory_boundary": "non_advisory",
  "recorded_at": "2026-02-20T09:00:00Z"
}
